{
  "schema_version": "1.0.0",
  "decision_id": "dec-provider-0001",
  "tenant_id": "tenant-acme",
  "correlation_id": "corr-2026-10-03-deploy-0001",
  "actor": {
    "type": "user",
    "id": "user-4821"
  },
  "resource": {
    "kind": "deployment",
    "id": "deploy-web-01"
  },
  "requested_action": "restore",
  "deciding_authority": "provider",
  "decision": "unavailable",
  "policy_id": "provider.registrar.capability",
  "reason_code": "PROVIDER_STATE_NOT_RECONCILED",
  "evidence": {
    "version": "policy-2026.10.1",
    "observed_at": "2026-10-03T10:00:00Z",
    "freshness": "stale"
  },
  "approval_ref": null,
  "expires_at": null,
  "idempotency_key": "idem-deploy-0001",
  "classification": "INTERNAL",
  "redaction_state": "none_required"
}
