{
  "schema_version": "1.0.0",
  "decision_id": "dec-egress-0005",
  "tenant_id": "tenant-acme",
  "correlation_id": "corr-2026-10-03-deploy-0001",
  "actor": {
    "type": "agent",
    "id": "agent-worker-3"
  },
  "resource": {
    "kind": "tool",
    "id": "web_search"
  },
  "requested_action": "model_egress",
  "deciding_authority": "omes",
  "decision": "allow",
  "policy_id": "ai-egress.policy.v1",
  "reason_code": "AI_EGRESS_ALLOW_LOCAL_ONLY",
  "evidence": {
    "version": "policy-2026.10.1",
    "observed_at": "2026-10-03T10:00:00Z",
    "freshness": "live"
  },
  "approval_ref": null,
  "expires_at": "2026-10-03T10:30:00Z",
  "classification": "INTERNAL",
  "redaction_state": "none_required"
}
